项目,主题,问题类型,优先级,
期权风控,证券各类投资者持有统计封闭式基金缩进不一致,软件缺陷,低,
期权风控,个人账户持有统计E账户的值没有汇到对应A账户,软件缺陷,普通,
期权风控,个人账户持有统计页面问题,软件缺陷,普通,
期权风控,证券各类投资者持有统计个人投资者数据错误,软件缺陷,普通,
期权风控,市场统计查询---参与者成交查询净卖出值显示错误,软件缺陷,普通,
期权风控,个人账户持有统计---个人账户持有统计界面类别建议修改产品类型,软件缺陷,低,
期权风控,图表展示-分时走势与时段净额图表页面错误,软件缺陷,普通,
期权风控,证券各类投资者持有统计点击标题可排序,软件缺陷,普通,
期权风控,证券各类投资者持有统计查询缓慢,软件缺陷,普通,
期权风控,证券各类投资者持有统计个人投资者区间显示顺序错误,软件缺陷,低,
期权风控,证券各类投资者持有统计的机构投资者小计错误,软件缺陷,普通,
期权风控,证券各类投资者持有统计导出及表头名称,软件缺陷,普通,
期权风控,证券各类投资者持有统计证券代码缺导入功能,软件缺陷,普通,
期权风控,债券专业投资者持有统计历史查询缓慢,软件缺陷,普通,
期权风控,债券专业投资者持有统计专业投资者数据显示都为0,软件缺陷,普通,
期权风控,市场统计查询---证券指数影响统计导出文件与界面不一致,软件缺陷,低,
期权风控,产品查询-债券成交统计小计中买入与卖出均价未除以10,软件缺陷,高,
期权风控,标的券交易查询母表指定证券查询会员融券专用账户余量值错误,软件缺陷,普通,
期权风控,查询后台日志错误,软件缺陷,低,
期权风控,会员查询和标的券交易查询会员融券专用账户余额债券未乘10,软件缺陷,普通,
期权风控,图表展示--融资融券变动上一交易日的数据未显示,软件缺陷,高,
期权风控,标的券交易查询控件不美观,软件缺陷,低,
期权风控,融资融券会员查询历史日期查询子表的流通股本取值错误,软件缺陷,普通,
期权风控,融资融券会员查询不带时间子表会员融券专业账户余量计算错误,软件缺陷,普通,
期权风控,分类投资者持有查询-企业年金持有统计导出错误,软件缺陷,低,
期权风控,分类投资者持仓查询-基金账户持有统计页面选择私募债和低等级债时计算错误,软件缺陷,普通,
期权风控,分类投资者申报查询-各类投资者申报统计申卖家数统计错误,软件缺陷,普通,
期权风控,各类投资者持有统计-各类投资者持有统计期末市值与期初市值计算错误,软件缺陷,高,
期权风控,产品查询-成交统计界面参与者层级为账户时界面报错,软件缺陷,低,
期权风控,融资融券会员查询母表导出日期与页面不一致,软件缺陷,低,
期权风控,融资融券会员查询母表合计多字段,软件缺陷,普通,
期权风控,融资融券会员查询子表会员信用担保品账户余量值计算错误,软件缺陷,普通,
期权风控,分类投资者申报查询-子表导出错误,软件缺陷,低,
期权风控,市场统计查询-参与者持仓查询子表导出错误,软件缺陷,低,
期权风控,市场统计查询-参与者成交查询合计数值重复,软件缺陷,普通,
期权风控,分类投资者申报查询-证券各类投资者申报统计页面错误,软件缺陷,普通,
期权风控,参与者申报统计产品类别中上证50指数成分股书写错误,软件缺陷,低,
期权风控,分类投资者持有查询-专户理财持有统计子表导出错误,软件缺陷,低,
期权风控,分类投资者持仓查询-基金账户持有统计页面子表错误,软件缺陷,低,
期权风控,融资融券变动导出文件产品类型显示null,软件缺陷,低,
期权风控,分类投资者持仓查询-一般机构投资者持有统计页面母表显示错误,软件缺陷,低,
期权风控,分时走势与时段净额图形各类投资者控件传参错误,软件缺陷,普通,
期权风控,分时走势与时段净额图形各类投资者与指数对比纵轴名称错误,软件缺陷,普通,
期权风控,分时走势与时段净额图形查询列表数值都居左,软件缺陷,低,
期权风控,分时走势与时段净额图形界面不美观,软件缺陷,低,
期权风控,分时走势与时段净额图形导出问题,软件缺陷,普通,
期权风控,图表展示中分时走势与时段净额图形页面，分时净额表错误,软件缺陷,高,
期权风控,4个图形页面日期选择大于交易日未控制,软件缺陷,普通,
期权风控,分类投资者申报导出汇总,软件缺陷,低,
期权风控,融资融券变动小数位问题,软件缺陷,普通,
期权风控,分类投资申报查询-证券各类投资者分类申报统计页面，信用账户申报汇总表中数据错误,软件缺陷,普通,
期权风控,持有统计的页面都不能点击标题排序,软件缺陷,低,
期权风控,分类投资者持有查询-导出文件中小数位与界面不符,软件缺陷,低,
期权风控,个人账户交易统计类别建议修改产品类型,软件缺陷,低,
期权风控,图形展示融资融券变动时间间隔按钮功能未实现,软件缺陷,普通,
期权风控,股指期货导出问题,软件缺陷,普通,
期权风控,股指期货走势查询界面问题,软件缺陷,普通,
期权风控,股指期货走势查询列表显示问题,软件缺陷,普通,
期权风控,建议现期走势图形主力合约选项显示为对应的中文,软件缺陷,低,
期权风控,分类投资者申报查询中B股各类投资者申报统计页面，不活跃家数计算错误,软件缺陷,普通,
期权风控,现期走势图形主要指数多选查询错误,软件缺陷,普通,
期权风控,市场统计查询中的参与者成交查询页面，平台类型为固收时，查询券商子表无显示,软件缺陷,普通,
期权风控,现期走势图形问题汇总,软件缺陷,普通,
期权风控,市场统计查询中参与者申报查询页面，母表中买未成交金额错误,软件缺陷,普通,
期权风控,分类投资者申报查询-个人账户申报统计导出类别显示null,软件缺陷,低,
期权风控,分类投资者交易/申报/持有低等级债导出显示错误,软件缺陷,低,
期权风控, 市场统计查询-参与者市值查询各类投资者查询时持有市值错误,软件缺陷,普通,
期权风控,市场统计查询中的参与者成交查询页面，母表错误,软件缺陷,普通,
期权风控,市场统计查询中证券指数影响统计页面，指数选择中证500导出后指数显示错误,软件缺陷,低,
期权风控,市场统计查询中的参与者申报查询页面，子表中显示错误,软件缺陷,低,
期权风控,市场统计查询-参与者市值查询历史日交易缓慢,软件缺陷,普通,
期权风控,各类投资者持有统计当日查询报错,软件缺陷,高,
期权风控,融资融券变动界面数据保留2位小数,软件缺陷,普通,
期权风控,分类投资者申报统计所有页面不带时间查询明细记录错误,软件缺陷,高,
期权风控,证券各类投资者申报统计问题汇总,软件缺陷,普通,
期权风控,分类投资者持仓查询-B股各类投资者持有统计页面显示错误,软件缺陷,普通,
期权风控,分类投资者申报界面券类型为国债（含地方债）、公司债、转债、质押式回购、买断式回购五种类型申买与申卖均价计算错误,软件缺陷,高,
期权风控,各类投资者持有统计A股统计范围错误,软件缺陷,普通,
期权风控,分类投资者导出问题汇总,软件缺陷,普通,
期权风控,INSTRUMENT_TYPE_MV新增类型脚本未提交,软件缺陷,高,
期权风控,图形展示融资融券变动问题汇总,软件缺陷,低,
期权风控,市场统计查询中的参与者成交查询页面，母表和子表对应不上,软件缺陷,普通,
期权风控,融资融券交易中的会员查询页面，数据库有值，页面没有显示,软件缺陷,普通,
期权风控,市场统计查询中的参与者申报查询页面，输入结束时间查不出相应结果,软件缺陷,普通,
期权风控,各类投资者申报统计小计合计计算错误,软件缺陷,普通,
期权风控,各类投资者申报统计部分数值单位未转化,软件缺陷,普通,
期权风控,查询页面错别字汇总,软件缺陷,低,
期权风控,融资融券交易-融资余额查询合计统计错误,软件缺陷,普通,
期权风控,市场统计查询中证券指数影响统计页面，指数选择中证500导出页面有错误,软件缺陷,低,
期权风控,股指期货走势查询列表行和列位置错误,软件缺陷,普通,
期权风控,现货走势图形页面条件选择主要指数后查询报错,软件缺陷,普通,
期权风控,分时走势与时段净额图形页面对比指数选择上证综指时页面报错,软件缺陷,低,
期权风控,期权参与者组合申报详情的申报来源未显示为对应的中文,软件缺陷,低,
期权风控,策略信息查询页面行权价高低顺序显示有NaN,软件缺陷,普通,
期权风控,债券专版后台日志错误,软件缺陷,低,
期权风控,国际版模块后台日志错误,软件缺陷,低,
期权风控,查询模块后台日志错误,软件缺陷,低,
期权风控,风险警示板产品查询日志描述建议完善,软件缺陷,低,
期权风控,查询-重点监控查询模块日志错误,软件缺陷,低,
期权风控,查询-一码通账户查询模块日志错误,软件缺陷,低,
期权风控,查询-优先股查询模块日志错误,软件缺陷,低,
期权风控,查询-固定收益平台查询模块日志错误,软件缺陷,低,
期权风控,查询-分类投资者查询模块后台日志报错,软件缺陷,低,
期权风控,查询-参与者查询模块后台日志报错,软件缺陷,低,
期权风控,查询-产品查询模块后台日志报错,软件缺陷,低,
期权风控,新兴板持股集中度统计列表标题格式未统一,软件缺陷,低,
期权风控,建议投资者买入超限查询页面刷新后子表列表清空,软件缺陷,普通,
期权风控,分类投资者查询查询，个人账户交易统计查询交易缓慢,软件缺陷,低,
期权风控,分类投资者查询债券专业投资界面平台类型大宗产品类型风险警示板非专业投资者卖出金额显示错误,软件缺陷,普通,
期权风控,新兴板分类投资查询界面平台类型为竞价交易日查询子表显示错误,软件缺陷,低,
期权风控,分类投资者查询中新兴板个人账户交易统计页面，导出后表格中的合计行小数位错误,软件缺陷,低,
期权风控,分类投资者查询-债券专业投资者产品类型风险警示板数据显示不正确,软件缺陷,普通,
期权风控,风险警示版分类投资者-投资者买入超限查询新兴板产品的数据显示与数据库中的值不符,软件缺陷,普通,
期权风控,新兴板块各页面导出问题,软件缺陷,普通,
期权风控,新兴板的市场统计查询中的市场金额排序统计页面平台类型为竞价时子表无显示,软件缺陷,高,
期权风控,产品查询界面申报统计前N名不输入界面报错,软件缺陷,普通,
期权风控,分类投资者查询界面竞价数据不显示,软件缺陷,普通,
期权风控,个股期权板块参与者账户组层级导出的账户组名称不一致未改全,软件缺陷,低,
期权风控,参与者期权组合持仓统计义务方默认排序,软件缺陷,普通,
期权风控,策略信息查询策略标志第三位为非N的字符情况报错,软件缺陷,低,
期权风控,策略信息查询合约为空记录建议合约张数显示为空,软件缺陷,低,
期权风控,个股期权板块参与者账户组层级导出的账户组名称不一致,软件缺陷,低,
期权风控,参与者期权组合申报详情合约为空记录的申报数量建议显示为空,软件缺陷,普通,
期权风控,参与者期权组合持仓统计界面问题,软件缺陷,普通,
期权风控,期权组合持有统计下参与者层级营业部时查询结果第一列建议加宽,软件缺陷,低,
期权风控,营业部期权组合托管统计的营业部代码列建议显示全,软件缺陷,低,
期权风控,参与者查询期权组合统计界面持仓方向与下载文件中持仓方向不符,软件缺陷,普通,
期权风控,参与者期权组合申报详情页面控件排版建议,软件缺陷,普通,
期权风控,参与者组合申报详情输出申报时间错误,软件缺陷,普通,
期权风控,建议参与者期权组合持仓统计默认排序按期末组合持仓降序,软件缺陷,普通,
期权风控,参与者期权组合持仓输出列表标题名称未修改一致,软件缺陷,低,
期权风控,参与者期权组合申报详情/组合持仓统计页面标题和控件显示问题,软件缺陷,普通,
期权风控,参与者组合持仓统计查询条件多前N名,软件缺陷,普通,
期权风控,期权组合持有统计与参与者组合持仓统计输出框架不一致,软件缺陷,普通,
期权风控,参与者期权组合持有统计页面排序问题,软件缺陷,普通,
期权风控,请开发确认参与者期权组合持仓统计名称显示,软件缺陷,低,
期权风控,参与者查询期权组合申报详情页面导出的结果中日期格式错误,软件缺陷,低,
期权风控,参与者组合申报详情消息类型为其他字符查询报错,软件缺陷,普通,
期权风控,参与者期权组合持有统计页面显示错误,软件缺陷,普通,
期权风控,参与者组合申报详情输出的申报来源未转化为中文,软件缺陷,普通,
期权风控,策略信息查询页面报错,软件缺陷,普通,
期权风控,参与者组合申报详情输出申报时间格式错误,软件缺陷,普通,
期权风控,参与者期权组合持有统计页面导出条件显示问题,软件缺陷,普通,
期权风控,参与者期权组合持有统计页面显示问题,软件缺陷,普通,
期权风控,参与者期权组合持有统计页面不要合计行,软件缺陷,低,
期权风控,参与者期权组合持有统计页面数据显示为空,软件缺陷,普通,
期权风控,参与者期权组合持有统计页面应该显示持仓量大于零的数据,软件缺陷,普通,
期权风控,产品期权组合持有统计页面应该显示持仓量大于零的数据,软件缺陷,普通,
期权风控,参与者查询期权组合申报详情页面导出的结果中账户组、券商、营业部名称为空,软件缺陷,普通,
期权风控,参与者查询期权组合申报详情页面导出的结果问题,软件缺陷,低,
期权风控,参与者查询期权组合申报详情页面查询条件有问题,软件缺陷,高,
期权风控,产品期权组合持有统计页面排序问题及建议,软件缺陷,低,
期权风控,策略信息查询页面建议,软件缺陷,低,
期权风控,参与者查询类型为账户组或营业部时，标签显示有问题,软件缺陷,普通,
期权风控,系统延迟查询刷新间隔无效,软件缺陷,普通,
期权风控,参与者持仓一码通账户存在大宗交易和固定交易，成交交易的账号持有统计子表显示错误,软件缺陷,普通,
期权风控,产品成交统计跨日含当日一码通层级子表显示错误,软件缺陷,普通,
期权风控,参与者一码通成交统计界面子表下载模板中标题多一个日期,软件缺陷,普通,
期权风控,参与持仓一码通账户关联的账号存在限售股交易，持仓不存在记录产品持有统计子表显示错误,软件缺陷,普通,
期权风控,产品持仓界面存在限售股交易，持仓不存在记录产品持有统计子表显示错误,软件缺陷,普通,
期权风控,参与者一码通持仓统计历史日期默认排序错误,软件缺陷,普通,
期权风控,产品查询成交统计页面平台类型为固定收益和大宗交易时子表显示有遗漏,软件缺陷,普通,
期权风控,产品查询成交统计页面参与者层级为一码通时竞价的子表显示错误,软件缺陷,高,
期权风控,参与者查询持仓统计页面涉及数量的数据多了小数位,软件缺陷,低,
期权风控,参与者查询申报统计母表导出第一行有错误,软件缺陷,低,
期权风控,信用账户查询表头问题,软件缺陷,普通,
期权风控,参与者一码通成交统计跨日含当日竞价查询一码通名称不显示,软件缺陷,低,
期权风控,参与者一码通持仓统计母表不能点击标题排序,软件缺陷,低,
期权风控,参与者一码通成交统计默认情况下点击查询子表应不显示,软件缺陷,普通,
期权风控,参与者一码通成交统计除跨日外的导出条件中缺成交价格和成交数量,软件缺陷,低,
期权风控,产品成交统计跨日含当日一码通按日统计查询报错,软件缺陷,普通,
期权风控,参与者一码通持仓统计前持仓和持仓都为0记录显示,软件缺陷,普通,
期权风控,参与者一码通持仓统计列标题多单位,软件缺陷,低,
期权风控,参与者一码通层级查询导出名称与页面不一致,软件缺陷,低,
期权风控,查询板块导出问题和子表无表头汇总,软件缺陷,普通,
期权风控,参与者查询子表导出条件不统一,软件缺陷,普通,
期权风控,产品查询成交统计页面平台类型为固定收益和大宗交易时点击【条件查询】按钮显示错误,软件缺陷,低,
期权风控,参与者查询页面子表数量字段不应该有小数位,软件缺陷,普通,
期权风控,产品查询成交统计页面参与者层级为一码通时竞价的子表显示错误,软件缺陷,低,
期权风控,产品查询成交统计页面跨日时按日统计情况下查询无结果,软件缺陷,普通,
期权风控,参与者申报详情页面数量没有千分位,软件缺陷,普通,
期权风控,参与者申报统计导出问题汇总,软件缺陷,普通,
期权风控,参与者为一码通时成交详情页面买、卖同时选择时会出现重复数据,软件缺陷,普通,
期权风控,参与者一码通持仓统计选过证券代码控件后再进入页面多控件,软件缺陷,普通,
期权风控,参与者一码通持仓统计子表查询信息与导出文本出错,软件缺陷,低,
期权风控,参与者一码通持仓统计界面历史交易日查询界面报错,软件缺陷,普通,
期权风控,参与者一码通成交统计跨日含当日查询竞价平台一码通数据未汇总,软件缺陷,普通,
期权风控,一码通子表导出条件不统一,软件缺陷,普通,
期权风控,产品查询一码通账户导入大于1000条没有提示,软件缺陷,普通,
期权风控,查询板块不同页面母表导出后保留小数位错误,软件缺陷,低,
期权风控,参与者持仓统计界面批量导入重复的一码通账户可以导入成功,软件缺陷,普通,
期权风控,参与者一码通持仓统计界面产品类型为优先股持仓市值计算错误,软件缺陷,普通,
期权风控,产品申报统计导入一码通账户查询不出结果,软件缺陷,普通,
期权风控,参与者一码通成交统计产品类型导入1000多个证券代码查询报错,软件缺陷,普通,
期权风控,参与者一码通成交统计跨日竞价产品类型条件无效,软件缺陷,普通,
期权风控,产品查询持仓统计证券类型为股票类小计功能和子表日期未显示,软件缺陷,普通,
期权风控,参与者一码通成交统计跨日导出条件多成交价格和成交数量,软件缺陷,普通,
期权风控,产品查询成交统计页面参与者层级为账户、营业部、券商时参与者代码输入后查询有问题,软件缺陷,普通,
期权风控,参与者一码通成交统计历史单日竞价查询排序错误,软件缺陷,普通,
期权风控,参与者一码通成交统计大宗和固收按日统计子表买入比例错误,软件缺陷,普通,
期权风控,参与者申报详情页面控件问题,软件缺陷,普通,
期权风控,产品查询成交统计页面平台类型为固定收益和大宗交易时母表和子表显示有遗漏,软件缺陷,高,
期权风控,参与者一码通成交统计跨日多日合计固收和大宗不含当日数据,软件缺陷,普通,
期权风控,产品查询成交统计页面平台类型为固定收益和大宗交易时输入参与者代码查询不到结果,软件缺陷,普通,
期权风控,参与者一码通成交统计固收和大宗母表均价计算错误,软件缺陷,普通,
期权风控,产品查询成交统计页面平台类型为固定收益和大宗交易时子表的均价没显示,软件缺陷,低,
期权风控,产品查询中成交统计页面导出的数据与页面数据不符,软件缺陷,低,
期权风控,参与者一码通成交统计导出一码通代码显示为名称,软件缺陷,低,
期权风控,参与者查询页面数量字段不应该有小数位,软件缺陷,普通,
期权风控,参与查询界面一码通导出文本功能实现错误,软件缺陷,普通,
期权风控,产品申报统计一码通子表导出问题,软件缺陷,普通,
期权风控,输出分子母表页面列表表头部分有括号部分无括号,软件缺陷,低,
期权风控,查询证券代码导出部分显示名称部分只显示代码,软件缺陷,普通,
期权风控,导入按钮显示的名称问题汇总,软件缺陷,普通,
期权风控,固定收益交易类型16债券质押式协议回购没有转换,软件缺陷,普通,
期权风控,参与者一码通申报统计母表分类合计问题,软件缺陷,普通,
期权风控,一码通账户数超过1000个情况一码通成交详情页报请求页面不存在,软件缺陷,普通,
期权风控,参与者申报/成交详情页价格没有保留3位小数,软件缺陷,普通,
期权风控,参与者查询一码通申报详情页面导出页面标题错误,软件缺陷,普通,
期权风控,建议参与者下拉项一码通名称一致,软件缺陷,普通,
期权风控,参与者一码通申报统计子表没有合计行,软件缺陷,普通,
期权风控,参与者查询页面显示问题汇总,软件缺陷,普通,
期权风控,建议一码通账户查询页面的一码通账户字段显示全,软件缺陷,低,
期权风控,参与者一码通申报统计页面点击表头可排序,软件缺陷,普通,
期权风控,参与者为一码通时成交详情页面的查询结果导出问题,软件缺陷,低,
期权风控,参与者查询页面代码为空不可查询,软件缺陷,普通,
期权风控,产品持有统计一码通层级母表表头没有写母表,软件缺陷,低,
期权风控,参与者查询申报统计页面导出功能问题汇总,软件缺陷,普通,
期权风控,产品持有统计ETF持有详情一码通界面买入比例与买出比例计算错误,软件缺陷,普通,
期权风控,参与者查询申报统计页面数据准确性有问题,软件缺陷,高,
期权风控,参与者查询申报统计页面报错,软件缺陷,高,
期权风控,产品查询页面申报统计查询结果子表显示问题,软件缺陷,普通,
期权风控,参与者查询一码通基本资料页面查询结果有问题,软件缺陷,普通,
期权风控,参与者查询页面一码通基础资料导出字段与页面不符,软件缺陷,低,
期权风控,参与者为非一码通时成交详情页面的查询结果列名错误,软件缺陷,低,
期权风控,参与者为一码通时成交详情页面的查询结果有问题,软件缺陷,高,
期权风控,产品查询持有统计问题汇总,软件缺陷,普通,
期权风控,所有一码通导入窗名称显示,软件缺陷,普通,
期权风控,一码通账户查询一码通导入按钮显示名称错误,软件缺陷,普通,
期权风控,一码通账户查询输出列表缺一码通名称字段,软件缺陷,普通,
期权风控,一码通账户查询导出缺查询条件,软件缺陷,普通,
期权风控,一码通账户查询账户输入框为空不可查询,软件缺陷,普通,
期权风控,一码通查询标题显示与需求不一致,软件缺陷,低,
期权风控,固收账户查询导出问题汇总,软件缺陷,普通,
期权风控,固收账户查询页面显示问题,软件缺陷,普通,
期权风控,固收账户查询一码通子表记录显示问题,软件缺陷,普通,
期权风控,产品查询与参与者查询界面查询导出本页结果小数位显示不正确,软件缺陷,低,
期权风控,债券专板中市场统计查询和分类投资者查询结果导出后小数位不正确,软件缺陷,低,
期权风控,个股期权版块期权重点监控账户组查询导出文件与界面显示小数位数不符,软件缺陷,低,
期权风控,风险警示板和国际版查询结果导出后小数位不正确,软件缺陷,低,
期权风控,个股期权板块“ETF交易价格与指数偏离”菜单名称与需求不符,软件缺陷,低,
期权风控,沪港通查询境外投资者持股比例盘前处理页面的持股比例最后一位小数位错误,软件缺陷,普通,
期权风控,融资融券通过网页下载后压缩包里的文件名乱码,软件缺陷,普通,
期权风控,所有境外投资者持股比例达到或超过警戒比例通知单导出后保留小数位错误,软件缺陷,普通,
期权风控,建议标的证券和期权合约合并查询子表标题的期权名称改为期权简称,软件缺陷,低,
期权风控,理论价格与实际价格偏离页波动率为空查询导出显示为empty,软件缺陷,低,
期权风控,沪港通查询境外投资者持股比例盘前处理页面文件生成只能生成当日文件,软件缺陷,普通,
期权风控,ETF交易价格与指数偏离计算页面查询后台日志报错,软件缺陷,低,
期权风控,ETF交易价格与指数偏离计算s8为0情况最新价没有取到前收盘价,软件缺陷,普通,
