项目,主题,问题类型,优先级,
期权风控,沪股通查询页面境外投资者持股比例盘前处理页面仅QIFF账号超过预警导出报错,软件缺陷,高,
期权风控,个股期权板理论价格与实际价格偏离查询页面错误信息,软件缺陷,普通,
期权风控,ETF交易价格与指数偏离计算母表默认排序错误,软件缺陷,普通,
期权风控,ETF交易价格与指数偏离计算页面导出问题,软件缺陷,低,
期权风控,ETF交易价格与指数偏离计算页面子表显示问题,软件缺陷,低,
期权风控,ETF交易价格与指数偏离计算页面时间控件问题,软件缺陷,普通,
期权风控,ETF交易价格与指数偏离计算页面报错,软件缺陷,高,
期权风控,沪股通标的证券申报和交易统计成交量为0情况成交比例显示为空,软件缺陷,低,
期权风控,期权-参与者成交统计导出问题,软件缺陷,低,
期权风控,沪股通标的证券申报和交易统计导出第一行显示问题,软件缺陷,普通,
期权风控,沪股通标的证券申报和交易统计母表合计行成交比例计算错误,软件缺陷,普通,
期权风控,标的证券和期权合约合并查询导出问题,软件缺陷,低,
期权风控,标的证券和期权合约合并查询时间控件问题,软件缺陷,普通,
期权风控,用户登录系统日志文件记录中登陆应改为登录,软件缺陷,低,
期权风控,标的证券和期权合约合并查询母表、子表表头显示和需求不一致,软件缺陷,低,
期权风控,理论价格与实际价格偏离查询表表头没有冒号,软件缺陷,低,
期权风控,境外投资者持股比例盘前处理生成文件报未知异常,软件缺陷,普通,
期权风控,境外投资者持股比例盘前处理生成文件报未知异常,软件缺陷,普通,
期权风控,建议境外投资者持股比例盘前处理输出列表高度加高,软件缺陷,低,
期权风控,沪股通额度查询页面查询结果显示建议,设计优化,低,
期权风控,参与者成交统计页面导出问题汇总,软件缺陷,普通,
期权风控,个股期权板参与者查询成交统计页面导出问题汇总,软件缺陷,普通,
期权风控,理论价格与实际价格偏离查询默认排序错误,软件缺陷,普通,
期权风控,理论价格与实际价格偏离查询条件提示信息和导出中存在隐含波动率,软件缺陷,普通,
期权风控,部分查询页面列表表头名称后有冒号,软件缺陷,低,
期权风控,标的证券和期权合约合并查询列表字段输出位置与需求不一致,软件缺陷,低,
期权风控,标的证券和期权合约合并查询导出问题,软件缺陷,低,
期权风控,标的证券和期权合约合并查询时间控件问题,软件缺陷,普通,
期权风控,债券质押式协议回购导出问题,软件缺陷,普通,
期权风控,建议债券质押式协议回购查询结果列表的业务类型显示为中文名称,软件缺陷,普通,
期权风控,参与者申报详情和成交详情页面数据超过1万条的时候没有出现弹窗,软件缺陷,普通,
期权风控,固定收益平台查询页面条件查询出错,软件缺陷,普通,
期权风控,沪股通额度查询页面日期为空格时查询出错,软件缺陷,普通,
期权风控,沪股通额度查询页面的标题名称没有加单位,软件缺陷,普通,
期权风控,分类投资者查询下的子页面历史日期不同时间段数据不一样,软件缺陷,普通,
期权风控,债券专版交易金额排序统计页面子表没有对债权质押式协议进行剔除,软件缺陷,普通,
期权风控,交易金额排序统计页面固定收益平台时国债类别没有数据,软件缺陷,低,
期权风控,交易金额排序统计页面跨日的时候页面报错,软件缺陷,普通,
期权风控,债券专板中的债券成交详情和债券成交统计页面的成交类型字段没有区分导致页面数据无法显示,软件缺陷,普通,
期权风控,境外投资者持股比例盘前处理页面名称错误,软件缺陷,普通,
期权风控,境外投资者持股比例盘前处理页面数据处理处理失败时提示不友好,软件缺陷,普通,
期权风控,境外投资者持股比例试算查询结果没有按照持股比例降序排列,软件缺陷,普通,
期权风控,沪股通申报统计页面没有申报记录的字段不要显示为0应该显示为空,软件缺陷,普通,
期权风控,沪股通申报统计页面没有说明产品是债券类型时申买金额需要乘于10,软件缺陷,普通,
期权风控,账户成交统计页面同一标的单日和跨日中的按日统计数据不一致,软件缺陷,普通,
期权风控,标的证券和期权合约合并查询页面字段和需求不一致,软件缺陷,普通,
期权风控,账户成交统计子表(合约)中成交数量字段错误,软件缺陷,普通,
期权风控,账户组成交统计页面报错,软件缺陷,普通,
期权风控,建议沪港通成交统计的金额值保留3位小数,软件缺陷,低,
期权风控,沪股通申报统计（子表）中债券的申报均价计算错误,软件缺陷,普通,
期权风控,沪股通成交统计页面选择开始和结束时间时应该是9点和17点而不是机器当前时间,软件缺陷,普通,
期权风控,沪股通成交统计页面查询输出为空的数据应该排在最下面而实际情况是排在了最上面,软件缺陷,普通,
期权风控,沪股通成交统计页面默认条件下的证券代码没有过滤掉非沪股通代码,软件缺陷,普通,
期权风控,参与者查询->账户成交统计  页面UI问题汇总,软件缺陷,低,
期权风控,参与者查询->账户成交统计  导出功能问题汇总,软件缺陷,普通,
期权风控,产品查询->期权成交详情 跨日查询的成交编号重复,软件缺陷,普通,
期权风控,参与者查询，申报统计页面的单张合约delta值计算错误,软件缺陷,高,
期权风控,"参与者查询-账户持仓统计  页面中的""账户""二字在导出的excel中显示为""账户代码""，二者名称需要统一",软件缺陷,普通,
期权风控,分类投资者查询中有交易明细表的页面，交易明细表无法导出,软件缺陷,普通,
期权风控,证券各类投资者分类统计中导出的excel文件中出现字符串。,软件缺陷,普通,
期权风控,风险警示板分类投资者中投资者买入超限查询页面，导出的excel文件中没有标题。,软件缺陷,低,
期权风控,参与者持仓统计跨日查询多方空方期初持有数量计算错误,软件缺陷,普通,
期权风控,参与者持仓统计跨日查询期初合约单位显示为期末合约单位值,软件缺陷,普通,
期权风控,行权期权风控表部分数据值翻倍,软件缺陷,普通,
期权风控,分类投资者部门页面查询条件控件没有对齐,软件缺陷,低,
期权风控,除个股期权板块外的页面导出报未知异常,软件缺陷,高,
期权风控,期权查询页面期权名称标题不一致,软件缺陷,低,
期权风控,行权查询导出的excel中查询条件不固定,软件缺陷,普通,
期权风控,行权期权风控查询的申报数量没有汇总,软件缺陷,普通,
期权风控,参与者持仓统计跨日查询某期权只存在一个日期情况合约子表显示有误,软件缺陷,普通,
期权风控,请开发确认参与者账户层级查询竞价部分数据包不包括账户对应的信用账户数据,软件缺陷,普通,
期权风控,参与者申报统计均价分母为0情况页面报错,软件缺陷,普通,
期权风控,参与者持仓统计标的券s8为0情况delta值为空,软件缺陷,高,
期权风控,账户/账户组持仓统计页面，跨日查询时，账户/账户组持仓统计输出子表（合约）中多个值汇总错误,软件缺陷,高,
期权风控,账户/账户组持仓统计页面，跨日查询期末单张合约delta和合计delta值错误,软件缺陷,高,
期权风控,参与者持仓统计标的券期初期末持仓为0情况标的子表的代码和简称不显示,软件缺陷,普通,
期权风控,账户/账户组持仓统计页面，持仓统计母表的合计delta值汇总错误,软件缺陷,高,
期权风控,账户/账户组持仓统计页面，当日多方、空方期末持有数量统计错误,软件缺陷,高,
期权风控,分类投资者-信托产品交易统计页面期权代码控件没有对期权代码进行过滤,软件缺陷,普通,
期权风控,参与者申报统计页面纵向滚动时按钮不固定,软件缺陷,低,
期权风控,参与者申报统计页面的券商申报统计子表（合约）中单张合约delta列查询无结果显示。,软件缺陷,普通,
期权风控,分类投资查询页面纵向滚动时导出按钮和列表表头不固定,软件缺陷,普通,
期权风控,个人交易统计页面交易区间为10万元以下持仓需求确认,软件缺陷,普通,
期权风控,个人账户交易统计页面带时间查询交易量翻倍,软件缺陷,普通,
期权风控,期权成交统计页面和期权申报统计页面查询控件显示问题,软件缺陷,低,
期权风控,参与者申报统计跨日查询时申报均价错误,软件缺陷,高,
期权风控,参与者申报统计页面数值为0情况显示不一致,软件缺陷,低,
期权风控,参与者申报统计母表默认排序有误,软件缺陷,普通,
期权风控,券商申报统计标的子表数值计算错误,软件缺陷,普通,
期权风控,参与者申报统计单张合约delta计算错误,软件缺陷,普通,
期权风控,参与者申报统计合约子表中申报数量不含撤单量,软件缺陷,普通,
期权风控,账户/账户组持仓统计delta计算错误,软件缺陷,高,
期权风控,分类投资者-各个页面刷新期权代码后多次查询只保留第一次查询的期权代码相关查询结果,软件缺陷,普通,
期权风控,账户/账户组持仓统计合约子表表头没有期末净持仓,软件缺陷,高,
期权风控,账户/账户组持仓统计结束日期为当日情况标的子表中期末持仓量、持仓市值为0,软件缺陷,普通,
期权风控,账户/账户组持仓统计合约明细一个期权代码有多条记录,软件缺陷,普通,
期权风控,账户持仓统计页面合约子表期初合约单位显示有误,软件缺陷,普通,
期权风控,账户/账户组持仓统计中结束日期为当日情况标的期末持有数量显示为0,软件缺陷,高,
期权风控,账户持仓统计母表中标的券没有持仓数据时标的简称显示为空,软件缺陷,普通,
期权风控,"期权成交详情页面字段""参与者层级""默认值有误",软件缺陷,普通,
期权风控,期权成交详情  买卖状态和备兑组合条件查询异常,软件缺陷,普通,
期权风控,行权查询权利方净持仓量计算有误,软件缺陷,普通,
期权风控,行权期权风控列表值计算错误,软件缺陷,高,
期权风控,专户理财、商业银行页面查询结果有错误记录,软件缺陷,普通,
期权风控,期权代码控件模糊查询输入数字后下拉框有重复记录,软件缺陷,低,
期权风控,券商自营账户交易统计页面查询速度较慢,软件缺陷,低,
期权风控,证券各类投资者分类统计中小计、合计计算错误,软件缺陷,普通,
期权风控,标的券代码控件模糊查询输入5后下拉结果中记录重复,软件缺陷,低,
期权风控,建议证券各类投资者分类统计查询结果去掉纵向滚动条,软件缺陷,低,
期权风控,企业年金、商业银行交易统计和专户理财交易统计，按合约月份、行权价类型查询的持仓结果错误,软件缺陷,高,
期权风控,期权成交统计页面一方有数据一方没有数据情况建议无数据那方显示为空,软件缺陷,低,
期权风控,期权成交统计历史日期查询的均价计算错误,软件缺陷,高,
期权风控,期权成交统计跨日按日统计默认排序错误,软件缺陷,普通,
期权风控,分类投资者各查询页面按单日或历史单日带时间段查询，期权代码取消全选后查询结果错误,软件缺陷,普通,
期权风控,基金账户交易统计查询条件全选时全选框未勾选,设计优化,低,
期权风控,期权申报统计页面报错（全量数据库脚本部署环境）,软件缺陷,普通,
期权风控,期权产品查询部分页面查询条件排列不美观,软件缺陷,低,
期权风控,期权成交详情/成交统计导出的合约单位没有右对齐,软件缺陷,低,
期权风控,期权成交详情/参与者成交详情页面输出结果中备兑没有分买方卖方,软件缺陷,普通,
期权风控,QFII账户交易统计页面查询刷新期权代码后提示不同,软件缺陷,普通,
期权风控,分类投资者所有页面导出的查询条件中引号标识不统一，建议修改,软件缺陷,普通,
期权风控,商业银行、企业年金、专户理财交易统计默认排序错误,软件缺陷,普通,
期权风控,分类投资者所有页面导出的excel中行权价类型显示错误,软件缺陷,普通,
期权风控,分类投资者查询明细表导出的金额有3位小数,软件缺陷,低,
期权风控,需求问题汇总,软件缺陷,低,
期权风控,期权风控导出问题汇总,软件缺陷,低,
期权风控,OPS004跌幅门限信息显示错误,软件缺陷,普通,
期权风控,营业部、券商查询部分页面只读查询条件没有置灰,软件缺陷,低,
期权风控,各类投资者交易统计查询导出的数据型数据没有右对齐,软件缺陷,低,
期权风控,账户/账户组持仓统计含现货查询090000~100000时间段记录不显示,软件缺陷,普通,
期权风控,账户/账户组持仓统计现货查询记录显示所有类型记录,软件缺陷,普通,
期权风控,行权查询页面申报来源相同情况输入账户查询与输入产品查询的查询结果不一致,软件缺陷,低,
期权风控,信托产品交易统计页面同一结束时刻的持仓量不一致,软件缺陷,高,
期权风控,期权持有统计页面显示了期初、期末都为0的记录,软件缺陷,低,
期权风控,期权申报统计页面查询结果列标题问题,软件缺陷,低,
期权风控,参与者申报详情中参与者代码参与者名称列显示与需求不一致,软件缺陷,低,
期权风控,信托产品交易统计页面详情表中同一结束时刻的持仓量不相同,软件缺陷,高,
期权风控,账户持仓统计勾选含现货时账户对应的信用账户的竞价记录不显示,软件缺陷,高,
期权风控,账户持仓统计含现货查询有误,软件缺陷,高,
期权风控,OPS004门限中席位描述错误，跌幅门限实际值显示负数,软件缺陷,普通,
期权风控,option_position_degree_h表收盘价取值错误,软件缺陷,普通,
期权风控,期权持有集中度查询标注日期有误,软件缺陷,普通,
期权风控,期权重点监控账户组查询默认排序,软件缺陷,普通,
期权风控,行权查询页面申报来源为其他时显示,软件缺陷,普通,
期权风控,期权期权风控页面导出功能报”未知异常“错误,软件缺陷,高,
期权风控,期权基本资料页中‘合约状态信息标签描述’显示与需求不符。,软件缺陷,普通,
期权风控,需求问题汇总,软件缺陷,低,
期权风控,参与者查询申报统计的申报均价计算错误,软件缺陷,高,
期权风控,期权持有集中度查询持有账户数、自由流通量值与需求不一致,软件缺陷,普通,
期权风控,期权申报统计页面申报均价计算错误,软件缺陷,高,
期权风控,程序化交易规模查询页面的申报金额算法错误,软件缺陷,高,
期权风控,期权持有集中度查询图表标注及导出,软件缺陷,普通,
期权风控,QFII账户交易统计查看类别为账户时账户名称显示为公司名称,软件缺陷,普通,
期权风控,企业年金交易统计页面导出文件中的数据格式不正确,软件缺陷,低,
期权风控,信托产品交易统计页面买卖详情表导出问题,软件缺陷,低,
期权风控,信托产品交易统计页面买卖详情表的默认排序错误,软件缺陷,低,
期权风控,分类投资者查询页面结束时间相同而持仓量不同,软件缺陷,高,
期权风控,分类投资者查询成交金额没有情况有的显示为空有的显示为0,软件缺陷,低,
期权风控,个人账户交易统计页面指定产品查询时持仓统计表中的持仓量错误,软件缺陷,高,
期权风控,个人账户交易数量区间单位需求确认,软件缺陷,高,
期权风控,一般机构投资者交易页面统计项为数量时买卖详情列表中显示内容还是金额的内容,软件缺陷,普通,
期权风控,一般机构投资者账户交易页面查询结果列表中数据较多时没有滚动条,软件缺陷,低,
期权风控,一般机构投资者交易页面导出及页面金额不保留三位小数问题,软件缺陷,普通,
期权风控,分类投资者查询页面期权代码下拉默认值问题,软件缺陷,高,
期权风控,分类投资者查询所有页面期权代码下拉内容错误,软件缺陷,高,
期权风控,理论价格与实际价格偏离查询页面理论价格为0的记录未显示,软件缺陷,低,
期权风控,理论价格与实际价格偏离查询页面任一偏离幅度等于门限记录未显示,软件缺陷,普通,
期权风控,期权基本资料页面中基本信息显示问题,软件缺陷,高,
期权风控,行权查询页面查询条件的顺序、位置不美观,软件缺陷,低,
期权风控,期权申报统计买入、卖出未成交量统计错误,软件缺陷,高,
期权风控,程序化交易规模查询页面时间段查询时未平仓量占比计算错误,软件缺陷,普通,
期权风控,程序化交易规模查询页面权利方、义务方未平仓量根据买卖状态不同而显示不同,软件缺陷,普通,
期权风控,账户、账户组持仓统计，盘中实时查询时含现货选项查询不到现货数据,软件缺陷,普通,
期权风控,账户持仓统计买入、卖出均价计算错误,软件缺陷,普通,
期权风控,程序化交易规模查询页面的申报金额计算时没有乘合约单位,软件缺陷,高,
期权风控,期权单边持仓超限查询页面无法查询到标的券流通股本为0的数据,软件缺陷,低,
期权风控,日内回转次数页面查询提示信息不友好,软件缺陷,低,
期权风控,账户持仓明细查询页面账户导入等问题,软件缺陷,低,
期权风控,期权产品持有量需求描述错误,软件缺陷,低,
期权风控,期权产品成交统计多日增减需求描述错误问题,软件缺陷,普通,
期权风控,需求修改：期权产品成交统计的均价计算描述错误,软件缺陷,普通,
期权风控,理论价格与实际价格偏离查询页面导出问题及页面展示问题,软件缺陷,低,
期权风控,期权参与者申报详情记录过万查询卡住（.2环境）,软件缺陷,普通,
期权风控,参与者成交统计单日时间段查询情况买入（卖出）比例计算不一致,软件缺陷,普通,
期权风控,页面中涉及文件导入控件的问题,软件缺陷,普通,
期权风控,账户成交统计跨日、大宗交易平台情况查询时状态栏出现错误信息,软件缺陷,低,
期权风控,参与者成交统计（非账户）跨日情况收盘前查询买入比例不正确,软件缺陷,普通,
期权风控,优先股集中度统计页面查询结果列标题名默认显示不全,软件缺陷,低,
期权风控,参与者成交统计页面的买入/卖出比例计算问题确认,设计优化,普通,
期权风控,申报统计、成交统计页面参与者层级为pbu时查询结果的参与者名称显示,软件缺陷,普通,
期权风控,期权持有结构页面显示问题,软件缺陷,低,
期权风控,账户成交统计跨日查询买入数量卖出数量保留3位小数,软件缺陷,普通,
期权风控,优先股查询明细查询页面导出文件中成交金额数据显示错误,软件缺陷,普通,
期权风控,优先股的股票基本资料页面查询返回0条数据,软件缺陷,普通,
期权风控,优先股查询中明细查询，账户代码选择为卖方账户时无数据显示。,软件缺陷,普通,
期权风控,证券各类投资者分类统计页面中部分投资者类型无数据,软件缺陷,高,
期权风控,系统管理监控对象设置页面中没有监控对象名称为监控优先股的监控对象,软件缺陷,普通,
期权风控,部署手册-监控对象设置操作中没有优先股与非优先股设置,软件缺陷,普通,
期权风控,优先股查询中营业部名称显示错误,软件缺陷,普通,
期权风控,优先股产品查询页面，按分日列示查询时，数据显示时间过长,设计优化,高,
期权风控,一般机构投资者中导出问题,软件缺陷,普通,
期权风控,融资余额查询页面当日停牌情况汇总表与明细表中的流通市值不一致,软件缺陷,普通,
期权风控,个股期权相关页面导出问题汇总,软件缺陷,低,
期权风控,参与者成交详情跨日查询记录重复,软件缺陷,低,
期权风控,期权持有结构页面显示问题,软件缺陷,低,
期权风控,期权持有结构页面义务方持有人数不正确,软件缺陷,普通,
期权风控,参与者持仓统计导出条件显示与页面不一致,软件缺陷,普通,
期权风控,期权申报统计合计买入卖出申报数量错误,软件缺陷,普通,
期权风控,账户组申报统计记录重复显示,软件缺陷,普通,
期权风控,账户申报统计输出结果分类错误,软件缺陷,普通,
期权风控,参与者成交统计买入/卖出比例计算问题,软件缺陷,普通,
期权风控,账户申报统计点击标题可排序,软件缺陷,普通,
期权风控,账户持仓统计列表表头显示错误,软件缺陷,普通,
期权风控,期权申报统计页面和期权成交统计页面中前N名显示问题,软件缺陷,低,
期权风控,期权持有集中度查询页面为空白页面,软件缺陷,普通,
期权风控,参与者基本资料页面的报警记录都为空,软件缺陷,普通,
期权风控,分类投资者查询页面统计项为数量情况买卖详情显示的是金额,软件缺陷,普通,
期权风控,分类投资者查询页面持仓统计、买卖详情列表默认排序不正确,软件缺陷,低,
期权风控,分类投资者查询页面部分列表框的表头未锁定,软件缺陷,低,
期权风控,理论价格与实际价格偏离页面当日最低价错误,软件缺陷,普通,
期权风控,券商集合理财交易统计类别为计划时持仓统计没有按计划名称汇总计算,软件缺陷,低,
期权风控,账户持仓/账户组持仓统计含现货持仓数量等字段显示为0,软件缺陷,普通,
期权风控,分类投资者查询，金额没有和需求中一致保留3位小数,软件缺陷,普通,
期权风控,期权各类投资者持仓统计，持仓量都为0 ,软件缺陷,高,
期权风控,期权单边持仓超限查询导出excle首行格式错误,软件缺陷,低,
期权风控,账户基本资料列表记录翻页时报错,软件缺陷,普通,
期权风控,企业年金交易统计页面导出文件中的卖出总金额与页面显示的不一致。,软件缺陷,普通,
期权风控,企业年金交易统计页面净额数值计算错误。,软件缺陷,普通,
期权风控,参与者成交统计买入/卖出比例计算问题,软件缺陷,普通,
期权风控,信托产品交易统计页面，买入金额数值格式与需求不符。,软件缺陷,普通,
期权风控,账户持仓统计/账户组持仓统计含现货查询标题显示问题,软件缺陷,普通,
期权风控,账户持仓统计含现货查询持仓市值显示为0,软件缺陷,普通,
期权风控,账户持仓/账户组持仓统计均价计算问题,软件缺陷,普通,
期权风控,重点监控账户组查询页面拖动滚动条时，表头没有固定。,设计优化,低,
期权风控,期权成交统计页面多日合计查询结果中买入记录未排序,软件缺陷,普通,
期权风控,账户组持仓统计含现货情况默认排序有误,软件缺陷,普通,
期权风控,期权参与者账户层级查询结果含信用账户,软件缺陷,普通,
期权风控,期权申报统计页面前N名不输入查询报错,软件缺陷,普通,
期权风控,参与者申报统计导出问题,软件缺陷,普通,
期权风控,期权申报统计页面账户层级查询申报卖出次数和卖出申报均价错误,软件缺陷,普通,
期权风控,期权成交统计页面没有根据排序类型过滤显示记录问题,软件缺陷,普通,
期权风控,期权申报统计页面，申报数量和申报数量不包括撤单数量,软件缺陷,普通,
期权风控,参与者持仓统计导出问题,软件缺陷,普通,
期权风控,账户组成交统计缺总计行,软件缺陷,普通,
期权风控,波动率曲面图显示问题,软件缺陷,低,
期权风控,期权持仓明细查询页面导入失败提示信息不友好,软件缺陷,低,
期权风控,参与者申报详情查询页面缩小后查询条件栏没有滚动条，产品类型控件名称换行,软件缺陷,普通,
期权风控,参与者申报详情、参与者成交详情页面导出显示与页面不一致,软件缺陷,普通,
期权风控,参与者查询所有页面，查询列表表头名称显示错误,软件缺陷,普通,
期权风控,期权申报详情和期权成交详情中时间显示错误,软件缺陷,普通,
期权风控,期权申报详情页面撤单记录的未成交量需求确认,软件缺陷,低,
期权风控,期权申报详情页面订单类型控件显示问题,软件缺陷,普通,
期权风控,账户组成交详情买卖状态全选时查询结果买卖显示不全,软件缺陷,普通,
期权风控,期权基本资料页面中基本信息显示问题,软件缺陷,普通,
期权风控,备兑控件先勾选非备兑后勾选备兑情况输入框显示错误,软件缺陷,普通,
期权风控,参与者成交详情的成交时间显示错误,软件缺陷,普通,
